{
  "contract_version": "leos.actor-context.v1",
  "identity": {
    "resource_type": "ACTOR_CONTEXT",
    "resource_id": "actor-context:brett:session-001",
    "display_name": "Brett local authenticated session",
    "revision": "sha256:actor-context-brett-session-001",
    "ownership": {
      "owner": {
        "principal_id": "principal:user:brett",
        "principal_type": "HUMAN_USER"
      },
      "creator": {
        "principal_id": "principal:service:identity-authority",
        "principal_type": "SERVICE"
      },
      "steward": {
        "principal_id": "principal:service:identity-authority",
        "principal_type": "SERVICE"
      },
      "lifecycle_authority": {
        "authority_id": "identity-authority",
        "principal": {
          "principal_id": "principal:service:identity-authority",
          "principal_type": "SERVICE"
        },
        "authority_revision": "sha256:identity-authority-policy-v1"
      }
    },
    "creation_actor_context_ref": {
      "resource_type": "ACTOR_CONTEXT",
      "resource_id": "actor-context:identity-authority:issuance-001",
      "revision": "sha256:actor-context-identity-authority-issuance-001"
    },
    "creation_authority_evidence_ref": {
      "authority_id": "identity-authority",
      "reference_id": "authority-mandate:actor-context-issuance",
      "revision": "sha256:authorization-actor-context-issuance-001"
    },
    "audit_id": "audit:actor-context:brett:session-001",
    "created_at": "2026-07-25T12:05:00Z",
    "updated_at": "2026-07-25T12:05:00Z"
  },
  "actor": {
    "principal_id": "principal:user:brett",
    "principal_type": "HUMAN_USER"
  },
  "authentication": {
    "authentication_id": "authentication:local:session-001",
    "subject": {
      "principal_id": "principal:user:brett",
      "principal_type": "HUMAN_USER"
    },
    "issuer": {
      "authority_id": "identity-authority",
      "principal": {
        "principal_id": "principal:service:identity-authority",
        "principal_type": "SERVICE"
      },
      "authority_revision": "sha256:identity-authority-policy-v1"
    },
    "method": "local-development-authenticator",
    "assurance": "DEVELOPMENT",
    "authenticated_at": "2026-07-25T12:05:00Z"
  },
  "issued_at": "2026-07-25T12:05:00Z",
  "expires_at": "2026-07-25T13:05:00Z"
}
